<?xml version="1.0" encoding="UTF-8"?>
<!DOCTYPE configuration SYSTEM "dtd/generator-proto.dtd">
<configuration>
	<global>
		<base-path 
			protoc="D:\project.apps\protoc-3.13.0-win64\bin"
			java_out="src/main/java"
			js_out="../hamonica-ims/hamonica-fe/src/protobuf"
		/>
	</global>
	<protobufs java="true" js="true" >
		<protobuf name="CacheMetricPack"/> 
		<protobuf name="Command"/> 
		<protobuf name="JvmMetricPack"/> 
		<protobuf name="Sender"/> 
		<protobuf name="ServerStatus"/> 
		<protobuf name="TransactionPack"/> 
	</protobufs>
</configuration>